{
  "compilerVersion": "fwsom-st-1.2.0",
  "conformanceClaim": "IEC 61131-3-aligned subset. KHÔNG tuyên bố certified/compliant (ADR-020).",
  "deliberateExclusions": [
    {
      "authority": "ADR-054 phán quyết (3)",
      "construct": "FOR",
      "inIec": true,
      "kind": "statement",
      "reason": "P1 — mọi scan phải chấm dứt trong thời gian chặn trên biết trước. Vòng lặp có số vòng phụ thuộc dữ liệu làm WCET không tính được tĩnh, nên bị loại vì ràng buộc AN TOÀN của DDC, không phải vì thiếu trong IEC."
    },
    {
      "authority": "ADR-054 phán quyết (3)",
      "construct": "WHILE",
      "inIec": true,
      "kind": "statement",
      "reason": "P1 — như FOR: điều kiện dừng phụ thuộc dữ liệu runtime, WCET không chặn trên được."
    },
    {
      "authority": "ADR-054 phán quyết (3)",
      "construct": "REPEAT",
      "inIec": true,
      "kind": "statement",
      "reason": "P1 — như WHILE, thêm việc thân luôn chạy ít nhất một lần."
    },
    {
      "authority": "hệ quả của ADR-054 phán quyết (3)",
      "construct": "EXIT",
      "inIec": true,
      "kind": "statement",
      "reason": "Chỉ có nghĩa bên trong vòng lặp; không có vòng lặp thì không có gì để thoát."
    },
    {
      "authority": "ST_SUBSET_SPEC §5",
      "construct": "RETURN",
      "inIec": true,
      "kind": "statement",
      "reason": "Nhiều điểm thoát làm cây WCET rẽ nhánh không cần thiết; FUNCTION gán kết quả qua ô trả về mang tên hàm như IEC quy định."
    },
    {
      "authority": "ST_SUBSET_SPEC §4.2",
      "construct": "**",
      "inIec": true,
      "kind": "operator",
      "reason": "Luỹ thừa trên REAL không có chặn trên chi phí tất định trên FPU mềm của target, và không có ca dùng HVAC nào trong Rev A. Dùng phép nhân tường minh."
    },
    {
      "authority": "ADR-054 phán quyết (4)",
      "construct": "STRING",
      "inIec": true,
      "kind": "type",
      "reason": "P2 — độ dài biến kéo theo cấp phát động trong chu kỳ scan. Loại trừ tới khi có kiểu chuỗi độ dài cố định."
    },
    {
      "authority": "ADR-054 phán quyết (4)",
      "construct": "DATE",
      "inIec": true,
      "kind": "type",
      "reason": "P2 — lịch/múi giờ thuộc tầng Schedule, không thuộc ngôn ngữ điều khiển chu kỳ."
    },
    {
      "authority": "ADR-054 phán quyết (4)",
      "construct": "TOD",
      "inIec": true,
      "kind": "type",
      "reason": "P2 — thời điểm trong ngày phụ thuộc múi giờ và quy tắc đổi giờ, hai thứ thuộc tầng Schedule. Chương trình chu kỳ nhận thời gian đã quy đổi qua Point, không tự diễn giải lịch."
    },
    {
      "authority": "ADR-054 phán quyết (4)",
      "construct": "DT",
      "inIec": true,
      "kind": "type",
      "reason": "P2 — ghép DATE và TOD nên thừa hưởng cả hai vấn đề lịch/múi giờ; loại trừ cùng lý do và cùng đợt."
    },
    {
      "authority": "ADR-023",
      "construct": "LD",
      "inIec": true,
      "kind": "language",
      "reason": "Ngoài phạm vi Programming Rev A."
    },
    {
      "authority": "ADR-023",
      "construct": "SFC",
      "inIec": true,
      "kind": "language",
      "reason": "Ngoài phạm vi Programming Rev A."
    },
    {
      "authority": "ADR-054 phán quyết (4)",
      "construct": "SINT",
      "inIec": true,
      "kind": "type",
      "reason": "P2 — số nguyên 8 bit không tiết kiệm gì trên ARM 32 bit của target mà lại thêm một bộ quy tắc tràn/ép kiểu nữa vào bề mặt kiểm thử. `INT` phủ trọn dải của nó."
    },
    {
      "authority": "ADR-054 phán quyết (4)",
      "construct": "USINT",
      "inIec": true,
      "kind": "type",
      "reason": "P2 — như `SINT`: dải giá trị nằm gọn trong `UINT`, thêm kiểu chỉ thêm ca ép kiểu phải chứng minh."
    },
    {
      "authority": "ADR-054 phán quyết (4)",
      "construct": "LINT",
      "inIec": true,
      "kind": "type",
      "reason": "P2 — số nguyên 64 bit có nghĩa cho bộ đếm dài hạn, nhưng ở Rev A mọi bộ đếm đều thuộc tầng Historian chứ không thuộc chương trình chu kỳ. `TIME` đã là int64 cho nhu cầu thời gian."
    },
    {
      "authority": "ADR-054 phán quyết (4)",
      "construct": "ULINT",
      "inIec": true,
      "kind": "type",
      "reason": "P2 — như `LINT`, và không có ca dùng HVAC nào cần dải không dấu 64 bit trong một chu kỳ scan."
    },
    {
      "authority": "ADR-054 phán quyết (4)",
      "construct": "UDINT",
      "inIec": true,
      "kind": "type",
      "reason": "P2 — `DINT` và `UINT` đã phủ các dải đang dùng thật; thêm một kiểu nguyên nữa nhân đôi bảng ép kiểu mà không mở thêm ca dùng nào."
    },
    {
      "authority": "ADR-054 phán quyết (4)",
      "construct": "LWORD",
      "inIec": true,
      "kind": "type",
      "reason": "P2 — đi cùng nhóm chuỗi bit `BYTE`/`WORD`/`DWORD`, vốn đã hoãn sang đợt sau; không tách riêng một mình 64 bit."
    },
    {
      "authority": "ADR-054 phán quyết (4)",
      "construct": "WSTRING",
      "inIec": true,
      "kind": "type",
      "reason": "P2 — thừa hưởng nguyên vấn đề cấp phát động của `STRING`, cộng thêm mã hoá rộng. Loại trừ cùng lý do và cùng đợt với `STRING`."
    },
    {
      "authority": "ADR-054 phán quyết (4)",
      "construct": "LN",
      "inIec": true,
      "kind": "function",
      "reason": "Hàm siêu việt trên FPU mềm của target không có chặn trên chi phí tất định, mà WCET của mọi scan phải tính được tĩnh. Không có ca dùng HVAC nào trong Rev A cần logarit."
    },
    {
      "authority": "ADR-054 phán quyết (4)",
      "construct": "LOG",
      "inIec": true,
      "kind": "function",
      "reason": "Cùng lý do với `LN`: chi phí phụ thuộc giá trị trên FPU mềm, không chặn trên tất định được."
    },
    {
      "authority": "ADR-054 phán quyết (4)",
      "construct": "EXP",
      "inIec": true,
      "kind": "function",
      "reason": "Cùng lý do với `LN`. Đường cong luỹ thừa trong điều khiển HVAC được xấp xỉ bằng bảng tra ở tầng ứng dụng, không bằng hàm ngôn ngữ."
    },
    {
      "authority": "ST_SUBSET_SPEC §4.2",
      "construct": "EXPT",
      "inIec": true,
      "kind": "function",
      "reason": "Dạng hàm của toán tử `**` đã bị loại; giữ một trong hai sẽ mở lại đúng chi phí mà việc loại `**` muốn tránh. Dùng phép nhân tường minh."
    },
    {
      "authority": "ADR-054 phán quyết (4)",
      "construct": "SIN",
      "inIec": true,
      "kind": "function",
      "reason": "Hàm lượng giác trên FPU mềm không có chặn trên tất định, và không có ca dùng HVAC nào trong Rev A cần lượng giác trong chu kỳ scan."
    },
    {
      "authority": "ADR-054 phán quyết (4)",
      "construct": "COS",
      "inIec": true,
      "kind": "function",
      "reason": "Cùng lý do với `SIN`."
    },
    {
      "authority": "ADR-054 phán quyết (4)",
      "construct": "TAN",
      "inIec": true,
      "kind": "function",
      "reason": "Cùng lý do với `SIN`, thêm điểm kỳ dị tại π/2 phải xử lý riêng cho chính sách NaN/Inf ở §6.3."
    },
    {
      "authority": "ADR-054 phán quyết (4)",
      "construct": "ASIN",
      "inIec": true,
      "kind": "function",
      "reason": "Cùng lý do với `SIN`, thêm miền xác định [-1, 1] phải kiểm ở runtime."
    },
    {
      "authority": "ADR-054 phán quyết (4)",
      "construct": "ACOS",
      "inIec": true,
      "kind": "function",
      "reason": "Cùng lý do với `ASIN`."
    },
    {
      "authority": "ADR-054 phán quyết (4)",
      "construct": "ATAN",
      "inIec": true,
      "kind": "function",
      "reason": "Cùng lý do với `SIN`."
    },
    {
      "authority": "ADR-054 phán quyết (4)",
      "construct": "TRUNC",
      "inIec": true,
      "kind": "function",
      "reason": "`REAL_TO_INT` và họ hàm ép kiểu tường minh đã phủ nhu cầu cắt phần thập phân, với quy tắc làm tròn công bố rõ ở §3.5. Hai đường cho một việc là hai ngữ nghĩa để trôi khỏi nhau."
    },
    {
      "authority": "ADR-054 phán quyết (4)",
      "construct": "MUX",
      "inIec": true,
      "kind": "function",
      "reason": "Chọn theo chỉ số cần kiểu hợp thành hoặc số tham số thay đổi; `SEL` phủ ca chọn hai nhánh, và `IF`/`CASE` phủ phần còn lại một cách đọc được hơn."
    },
    {
      "authority": "ADR-054 phán quyết (4); Issue #800",
      "construct": "ROL",
      "inIec": true,
      "kind": "function",
      "reason": "Xoay bit chưa có nhu cầu hiện trường; `SHL`/`SHR` trên `UINT` đã mở theo Issue #800 (U-10). Xoay vòng sẽ xét cùng kiểu `WORD`/`BYTE`/`DWORD` ở đợt sau."
    },
    {
      "authority": "ADR-054 phán quyết (4); Issue #800",
      "construct": "ROR",
      "inIec": true,
      "kind": "function",
      "reason": "Xoay bit chưa có nhu cầu hiện trường; `SHL`/`SHR` trên `UINT` đã mở theo Issue #800 (U-10). Xoay vòng sẽ xét cùng kiểu `WORD`/`BYTE`/`DWORD` ở đợt sau."
    },
    {
      "authority": "ADR-054 phán quyết (4)",
      "construct": "LEN",
      "inIec": true,
      "kind": "function",
      "reason": "Hàm chuỗi theo sau kiểu `STRING`, vốn bị loại vì cấp phát động trong chu kỳ scan. Liệt kê riêng từng tên để cổng đối chiếu kiểm được từng cái, thay vì một dòng gộp không kiểm được."
    },
    {
      "authority": "ADR-054 phán quyết (4)",
      "construct": "LEFT",
      "inIec": true,
      "kind": "function",
      "reason": "Hàm chuỗi, theo sau loại trừ `STRING` (cấp phát động trong chu kỳ scan)."
    },
    {
      "authority": "ADR-054 phán quyết (4)",
      "construct": "RIGHT",
      "inIec": true,
      "kind": "function",
      "reason": "Hàm chuỗi, theo sau loại trừ `STRING`."
    },
    {
      "authority": "ADR-054 phán quyết (4)",
      "construct": "MID",
      "inIec": true,
      "kind": "function",
      "reason": "Hàm chuỗi, theo sau loại trừ `STRING`."
    },
    {
      "authority": "ADR-054 phán quyết (4)",
      "construct": "CONCAT",
      "inIec": true,
      "kind": "function",
      "reason": "Hàm chuỗi, theo sau loại trừ `STRING`. Nối chuỗi còn là ca cấp phát động rõ rệt nhất: độ dài kết quả chỉ biết tại runtime."
    },
    {
      "authority": "ADR-054 phán quyết (4)",
      "construct": "INSERT",